Table,seq,frame_lv2,frame_lv3,variable_name,variable_label,값_김철수,근거_녹취록
COMPETECY_RES,1,Design 역량,문제 구조화,design_problem_structuring_score,문제 구조화 파악,Y,Q1: 수익성·성장성 충돌을 KPI 구조 재설계로 해소. Q3: 멜론 M&A 통합 기획에서 문화 충돌 변수 누락을 사후 인지하고 이후 기획에 반영.
COMPETECY_RES,2,Design 역량,종합적 Planning,design_integrated_planning_score,종합적 Planning 역량,Y,Q3: M&A 수직 통합 수익 모델·JV 시나리오 플랜을 이해관계자(아티스트·파트너·이사회) 중심으로 설계. Q8: 위치기반 광고 사전 가이드라인 구조화로 규제 진입 장벽 역전환.
COMPETECY_RES,3,Design 역량,Deep Change 실행,design_deep_change_execution_score,Deep Change 실행,Y,Q2: AI 병목 돌파 시 성공 사례 공유 + 리더 직접 시범 사용으로 조직 저항 해소. Q15: 역량 부족 팀원에게 시니어 페어 붙여 6개월 만에 최고 성과자로 전환.
COMPETECY_RES,4,Learning Agility,미래 준비 역량,self_development_plan,자기 역량 개발 계획,조직 감수성 강화 목적으로 매주 팀원 1인과 업무 무관 30분 대화 루틴 실행 중. 시작 2개월 팀 내 긴장 관계 2건 파악.,Q19
COMPETECY_RES,5,Learning Agility,미래 준비 역량,learning_related_training_experience,관련 교육 참여,녹취록 내 직접 언급 없음. CEO 네트워크 정기 모임(이사회 관계 설계 학습 목적) 언급.,Q20
COMPETECY_RES,6,Learning Agility,미래 준비 역량,learning_agility_future_readiness_score,미래 준비 역량,Y,Q4: 빠른 결정 → 빠른 실험 의사결정 방식 전환. GPT-4 등장 이후 선제 적용.
COMPETECY_RES,7,Learning Agility,Globality,learning_agility_global_execution_score,글로벌 실행 역량,Y,Q6: 현지 정부 신뢰 구축 방식 습득 (성공 사례 대신 실패 사례 공개로 신뢰 전환). 7개국 법인 Hub-Spoke 재편 실행.
COMPETECY_RES,8,Learning Agility,AX 혁신,learning_agility_ax_innovation_score,AX 혁신 역량,Y,Q9: AI Native Telecom 비전 임원 의사결정 AI 보조 반영 비율 70%라는 측정 가능 지표 제시. 현재 30% 달성.
